{
  "$schema": "https://json-schema.org/draft/2020-12/schema",
  "$id": "https://sentinel-relay.dev/schemas/agent-message.schema.json",
  "title": "Sentinel Relay Agent Message",
  "type": "object",
  "additionalProperties": true,
  "required": [
    "id",
    "schemaVersion",
    "caseId",
    "roomId",
    "sequence",
    "agentId",
    "agentName",
    "type",
    "title",
    "summary",
    "confidence",
    "severity",
    "evidenceIds",
    "createdAt",
    "visibility"
  ],
  "properties": {
    "id": { "type": "string", "minLength": 1 },
    "schemaVersion": { "type": "string", "minLength": 1 },
    "caseId": { "type": "string", "minLength": 1 },
    "roomId": { "type": "string", "minLength": 1 },
    "sequence": { "type": "integer", "minimum": 1 },
    "agentId": { "type": "string", "minLength": 1 },
    "agentName": { "type": "string", "minLength": 1 },
    "type": {
      "type": "string",
      "enum": [
        "case_opened",
        "room_created",
        "agent_joined",
        "task_assignment",
        "finding",
        "challenge",
        "verification",
        "risk_assessment",
        "approval_request",
        "approval_decision",
        "remediation_task",
        "report_section",
        "state_update",
        "handoff",
        "watchdog_alert"
      ]
    },
    "title": { "type": "string", "minLength": 1 },
    "summary": { "type": "string", "minLength": 1 },
    "confidence": { "type": "number", "minimum": 0, "maximum": 1 },
    "severity": { "type": "string", "enum": ["informational", "low", "medium", "high", "critical"] },
    "evidenceIds": { "type": "array", "items": { "type": "string" } },
    "targetAgentIds": { "type": "array", "items": { "type": "string" } },
    "createdAt": { "type": "string", "format": "date-time" },
    "visibility": { "type": "string", "enum": ["judge_demo", "internal", "security_lead_only"] },
    "decisionImpact": { "type": "string" },
    "nextAction": { "type": "string" },
    "correlationId": { "type": "string" },
    "payload": { "type": "object" }
  }
}
