[
  {
    "id": "msg-inc-1042-001",
    "schemaVersion": "0.4.0",
    "caseId": "INC-1042",
    "roomId": "band-room-inc-1042",
    "sequence": 1,
    "agentId": "agent-commander",
    "agentName": "Band Leader",
    "type": "case_opened",
    "title": "INC-1042 opened: treat as active credential compromise (svc-payments-api)",
    "summary": "Opened the Band room for INC-1042 and framing it as an active credential compromise until proven otherwise: A suspicious API usage spike appeared shortly after a Friday deploy. Specialist agents must determine whether a token was exposed, whether customer data was accessed, what requires human approval, and what remediation should happen next. Registered forensics, threat intel, code review, risk/compliance, and remediation. Working hypothesis to confirm/refute: ALLOW_FALLBACK_TOKEN fail-open path + committed .env.release exposed a credential for subject svc-payments-api and it is being used from external sources.",
    "confidence": 1.0,
    "severity": "high",
    "evidenceIds": [],
    "targetAgentIds": [
      "agent-forensics",
      "agent-threat-intel",
      "agent-code-review",
      "agent-risk-compliance",
      "agent-remediation"
    ],
    "createdAt": "2026-06-12T21:08:11Z",
    "visibility": "judge_demo",
    "decisionImpact": "Creates the shared coordination space and the case file every specialist anchors to.",
    "nextAction": "Assign evidence-review tasks; forensics establishes the exposure window first.",
    "correlationId": "trace-inc-1042-001",
    "payload": {
      "kind": "case_opened",
      "data": {
        "roomCreated": true,
        "registeredAgentIds": [
          "agent-forensics",
          "agent-threat-intel",
          "agent-code-review",
          "agent-risk-compliance",
          "agent-remediation"
        ],
        "caseFile": {
          "detectionSource": "Customer Records API usage spike after the Friday deploy",
          "secretType": "application service bearer token (fallback for subject svc-payments-api)",
          "affectedIdentity": "svc-payments-api (reaches customer summary, bulk export, payment-methods)",
          "repoBranch": "to confirm with repo owner (not in evidence packet)",
          "introducingCommitSha": "to confirm \u2014 diff blobs 61bf8b2->e248d7a",
          "deployImageId": "release-9814 (ci-release-role) / Lambda customer-records-api",
          "owner": "Human Security Lead",
          "earliestExposureTime": "2026-06-12T20:47:11Z (deploy enabled ALLOW_FALLBACK_TOKEN)",
          "firstObservedUnauthorizedUse": "2026-06-12T21:04:59Z",
          "issuerVerifiedInactiveAt": "2026-06-12T21:12:02Z",
          "stillLive": "to be answered by issuer logs; do not assume rotation == dead",
          "logsToPreserve": [
            "ev-api-gateway-logs",
            "ev-auth-events",
            "ev-cloudtrail-events",
            "ev-secret-scan",
            "ev-code-diff",
            "Lambda config history"
          ]
        },
        "containmentDoctrine": "Issuer-first: revoke/rotate at the provider before code/history cleanup, which can recontaminate from old clones."
      }
    }
  },
  {
    "id": "msg-inc-1042-002",
    "schemaVersion": "0.4.0",
    "caseId": "INC-1042",
    "roomId": "band-room-inc-1042",
    "sequence": 2,
    "agentId": "agent-commander",
    "agentName": "Band Leader",
    "type": "task_assignment",
    "title": "Task assigned to Forensics",
    "summary": "Assigning Forensics to: Quantify exposure from gateway, auth, and CloudTrail logs. Cite evidence IDs, name the affected identity and its reach, and assign a confidence.",
    "confidence": 1.0,
    "severity": "high",
    "evidenceIds": [],
    "targetAgentIds": [
      "agent-forensics"
    ],
    "createdAt": "2026-06-12T21:08:22Z",
    "visibility": "judge_demo",
    "decisionImpact": "Distributes the investigation so no single agent decides alone.",
    "nextAction": "Wait for an evidence-backed report from Forensics.",
    "correlationId": "trace-inc-1042-002",
    "payload": {
      "kind": "task_assignment",
      "data": {
        "taskId": "task-agent-forensics",
        "assignedToAgentId": "agent-forensics",
        "objective": "Quantify exposure from gateway, auth, and CloudTrail logs.",
        "acceptanceCriteria": [
          "Cite evidence IDs",
          "Name the affected identity and its permissions/reach",
          "Assign confidence",
          "State limitations"
        ]
      }
    }
  },
  {
    "id": "msg-inc-1042-003",
    "schemaVersion": "0.4.0",
    "caseId": "INC-1042",
    "roomId": "band-room-inc-1042",
    "sequence": 3,
    "agentId": "agent-commander",
    "agentName": "Band Leader",
    "type": "task_assignment",
    "title": "Task assigned to Code Review",
    "summary": "Assigning Code Review to: Identify the deploy change that introduced the exposure path. Cite evidence IDs, name the affected identity and its reach, and assign a confidence.",
    "confidence": 1.0,
    "severity": "high",
    "evidenceIds": [],
    "targetAgentIds": [
      "agent-code-review"
    ],
    "createdAt": "2026-06-12T21:08:33Z",
    "visibility": "judge_demo",
    "decisionImpact": "Distributes the investigation so no single agent decides alone.",
    "nextAction": "Wait for an evidence-backed report from Code Review.",
    "correlationId": "trace-inc-1042-003",
    "payload": {
      "kind": "task_assignment",
      "data": {
        "taskId": "task-agent-code-review",
        "assignedToAgentId": "agent-code-review",
        "objective": "Identify the deploy change that introduced the exposure path.",
        "acceptanceCriteria": [
          "Cite evidence IDs",
          "Name the affected identity and its permissions/reach",
          "Assign confidence",
          "State limitations"
        ]
      }
    }
  },
  {
    "id": "msg-inc-1042-004",
    "schemaVersion": "0.4.0",
    "caseId": "INC-1042",
    "roomId": "band-room-inc-1042",
    "sequence": 4,
    "agentId": "agent-commander",
    "agentName": "Band Leader",
    "type": "task_assignment",
    "title": "Task assigned to Threat Intel",
    "summary": "Assigning Threat Intel to: Assess the external source IPs without overstating attribution. Cite evidence IDs, name the affected identity and its reach, and assign a confidence.",
    "confidence": 1.0,
    "severity": "high",
    "evidenceIds": [],
    "targetAgentIds": [
      "agent-threat-intel"
    ],
    "createdAt": "2026-06-12T21:08:44Z",
    "visibility": "judge_demo",
    "decisionImpact": "Distributes the investigation so no single agent decides alone.",
    "nextAction": "Wait for an evidence-backed report from Threat Intel.",
    "correlationId": "trace-inc-1042-004",
    "payload": {
      "kind": "task_assignment",
      "data": {
        "taskId": "task-agent-threat-intel",
        "assignedToAgentId": "agent-threat-intel",
        "objective": "Assess the external source IPs without overstating attribution.",
        "acceptanceCriteria": [
          "Cite evidence IDs",
          "Name the affected identity and its permissions/reach",
          "Assign confidence",
          "State limitations"
        ]
      }
    }
  },
  {
    "id": "msg-inc-1042-005",
    "schemaVersion": "0.4.0",
    "caseId": "INC-1042",
    "roomId": "band-room-inc-1042",
    "sequence": 5,
    "agentId": "agent-forensics",
    "agentName": "Forensics Agent",
    "type": "finding",
    "title": "svc-payments-api fallback token: 10,227 records read across a verified-closed window",
    "summary": "Treating this as an active credential compromise: the static fallback bearer token for subject svc-payments-api was loaded after a Secrets Manager throttle (2026-06-12T20:55:38Z) and then used by 2 off-baseline external IPs (198.51.100.188, 203.0.113.77) to read 10,227 customer records (bulk export + payment-methods) until the issuer verified the token dead at 2026-06-12T21:12:02Z. The exposure window opened at the 2026-06-12T20:47:11Z deploy, not at first abuse; rotation started 2026-06-12T21:11:38Z but the window only closes on the issuer deny. Records were returned to unauthorized sources, but actor identity and any downstream reuse are unproven from logs alone.",
    "confidence": 0.86,
    "severity": "high",
    "evidenceIds": [
      "ev-api-gateway-logs",
      "ev-auth-events",
      "ev-cloudtrail-events"
    ],
    "targetAgentIds": [
      "agent-commander"
    ],
    "createdAt": "2026-06-12T21:08:55Z",
    "visibility": "judge_demo",
    "decisionImpact": "Quantifies confirmed unauthorized data-plane access and fixes the exposure window for the legal clock, but does not by itself prove actor identity or downstream misuse.",
    "nextAction": "Risk & Compliance should classify severity and the breach-notification posture; Code Review should hunt for sibling credentials that survive rotation. Do not yet claim confirmed exfiltration.",
    "correlationId": "trace-inc-1042-005",
    "payload": {
      "kind": "finding",
      "data": {
        "findings": [
          {
            "claim": "Exposure window opened with the Friday deploy at 2026-06-12T20:47:11Z and is issuer-verified closed at 2026-06-12T21:12:02Z; rotation alone did not close it \u2014 the issuer deny did.",
            "evidenceRef": "ev-cloudtrail-events",
            "source": "cloudtrail_events.jsonl",
            "observation": "UpdateFunctionConfiguration set ALLOW_FALLBACK_TOKEN=true at 2026-06-12T20:47:11Z (arn:aws:sts::111122223333:assumed-role/ci-release-role/release-9814); Secrets Manager GetSecretValue threw ThrottlingException at 2026-06-12T20:55:36Z, forcing the fallback path."
          },
          {
            "claim": "Compromised principal is the service identity svc-payments-api via its STATIC fallback bearer token svc-payments-fallback-redacted, not an AWS IAM key \u2014 blast radius is whatever that subject can call on Customer Records.",
            "evidenceRef": "ev-auth-events",